{
  "access": "read-only",
  "branch": "feat/intellix-multiagent-framework",
  "control_plane_digest": "sha256:7b912261cb6356c76bed9272a1ac30dbb642601a102b7249d106024386b951ee",
  "decision": "approved",
  "diff_ref": "efb01c090b08121b15308048b5fdb58e888feebd..d4fd41187c2dc2596ccf2e290fbc147168a4e3cb",
  "evidence": [
    "Independent Claude read-only review verified HEAD, clean worktree, efb01c0..d4fd411 fileset and returned APPROVED."
  ],
  "executor_identity": "codex",
  "fileset_digest": "sha256:732a9359adbbf4d5dacba8b0b4d45b56c9c582ffc1d7e3164e3f88d99e1c187d",
  "kernel_digest": "sha256:82d538fc4be868fbe64e2669a8ffceaceb00c9fcc523716c6430998ffc0dc8a5",
  "limitations": [
    "Reviewer did not independently rerun the full test suite or exact-revision CI.",
    "Local reviewer identity is forgeable process evidence, not authentication."
  ],
  "phase_base": "efb01c090b08121b15308048b5fdb58e888feebd",
  "project_digest": "sha256:31eaf68436c8291fd2652730b1a7e0c2c866d751ed71629418a3fcf0a919cbc1",
  "reviewed_at": "2026-09-23T17:38:30+00:00",
  "reviewed_files": [
    "tasks/TASK-007.yaml"
  ],
  "reviewed_revision": "d4fd41187c2dc2596ccf2e290fbc147168a4e3cb",
  "reviewer_assignment": "claude-independent",
  "reviewer_identity": "claude-independent-read-only-task-007-d4fd411",
  "schema_version": "1.0.0",
  "source_digest": "sha256:acdf1dc23bd74e45091b5ab37ba556432c5f2fa3a2a98f3e6075cc8d8410127c",
  "task": "TASK-007",
  "task_digest": "sha256:49d9c1c1e08b736ddd8b3f76acf3eaf9c3f9151e623e0c494445a6561e73ac77"
}
