{
  "access": "read-only",
  "branch": "feat/intellix-multiagent-framework",
  "control_plane_digest": "sha256:7b912261cb6356c76bed9272a1ac30dbb642601a102b7249d106024386b951ee",
  "decision": "approved",
  "diff_ref": "75b23e5c0997db3a8b2e915d0f7fc2ee2d277ed8..10260dc9a373e6bf6f02c8b438d78809fc8ff436",
  "evidence": [
    "Independent Claude read-only review verified HEAD, clean worktree, 75b23e5..10260dc fileset and returned APPROVED."
  ],
  "executor_identity": "codex",
  "fileset_digest": "sha256:3a042da06652725b6f523ff4fdc076eba2e7d13d74517ae7199b9889fed47667",
  "kernel_digest": "sha256:82d538fc4be868fbe64e2669a8ffceaceb00c9fcc523716c6430998ffc0dc8a5",
  "limitations": [
    "Reviewer did not independently rerun validators, tests, hooks or exact-revision CI.",
    "Local reviewer identity is forgeable process evidence, not authentication."
  ],
  "phase_base": "75b23e5c0997db3a8b2e915d0f7fc2ee2d277ed8",
  "project_digest": "sha256:31eaf68436c8291fd2652730b1a7e0c2c866d751ed71629418a3fcf0a919cbc1",
  "reviewed_at": "2026-09-23T17:46:30+00:00",
  "reviewed_files": [
    "tasks/TASK-009.yaml"
  ],
  "reviewed_revision": "10260dc9a373e6bf6f02c8b438d78809fc8ff436",
  "reviewer_assignment": "claude-independent",
  "reviewer_identity": "claude-independent-read-only-task-009-10260dc",
  "schema_version": "1.0.0",
  "source_digest": "sha256:39b4eab1a2f7b4aac518db315968746dc49e75edfd1ba97108064bd789f07b3e",
  "task": "TASK-009",
  "task_digest": "sha256:f5c304a5e07109c0cd44f77de436eb0e5ddd4076f99e0b182d768b869e706d9b"
}
